{
 "name": "hermes",
 "version": "2.0.0",
 "contract_version": "1",
 "capabilities": [
  "resume_session",
  "model_select",
  "provider_select",
  "tool_restrict",
  "interactive_room",
  "usage_report",
  "model_catalog"
 ],
 "wake_modes": [
  "headless",
  "tmux",
  "manual"
 ],
 "bin": "hermes"
}
